{
    "$schema": "../../../schema/evaluationResults.schema.json",
    "version": 1.0,
    "release": "2026/08/21",
    "author": "Antigravity",
    "debugMode": true,
    "evaluationResults": {
        "psfData": "/home/lary/simulation/BVU025/BVU025A/sim_TOP_cosim_sv_A1/ams/config/psf",
        "outputFile": "/home/lary/simulation/BVU025/BVU025A/sim_TOP_cosim_sv_A1/ams/config/evaluation/cosim.evaluationResults.json",
        "evaluation": {
            "expressions": {
                "i_gpio8_1p8m": "value(IT(\"/Board/GPIO8\") 1.8m)"
            }
        }
    }
}
